{
  "$schema": "./v1.schema.json",
  "artifact_id": "keel.permit.fact_profile_registry",
  "version": "keel.fact_profile_registry.v1",
  "canonicalization_profile": "rfc8785",
  "profiles": [
    {
      "fact_profile_id": "keel.facts.payment_exact.v1",
      "semantic_ids": [
        "keel.action.payment_execute.v1"
      ],
      "facts_schema": "schemas/payment-exact-facts-v1.schema.json",
      "facts_schema_digest": "sha256:b12f4bdca4fd759ea624d73f5d1cf65f4f103a2d55218a8be28b156aba871cf2",
      "fields": [
        {
          "path": "/amount_minor",
          "value_type": "integer",
          "required_for_authorization": true,
          "classification": "financial",
          "bulk_export_disclosure": "omit",
          "exact_pack_disclosure": "cleartext",
          "retention_class": "permit_evidence",
          "erasable": true,
          "commitment_method": "signed_cleartext"
        },
        {
          "path": "/currency",
          "value_type": "string",
          "required_for_authorization": true,
          "classification": "financial",
          "bulk_export_disclosure": "omit",
          "exact_pack_disclosure": "cleartext",
          "retention_class": "permit_evidence",
          "erasable": true,
          "commitment_method": "signed_cleartext"
        },
        {
          "path": "/recipient_reference_commitment",
          "value_type": "commitment",
          "required_for_authorization": true,
          "classification": "personal_data",
          "bulk_export_disclosure": "omit",
          "exact_pack_disclosure": "commitment_with_optional_opening",
          "retention_class": "deletable_identity",
          "erasable": true,
          "commitment_method": "keel.salted_sha256_jcs.v1"
        },
        {
          "path": "/recipient_display_name_commitment",
          "value_type": "commitment",
          "required_for_authorization": false,
          "classification": "personal_data",
          "bulk_export_disclosure": "omit",
          "exact_pack_disclosure": "commitment_with_optional_opening",
          "retention_class": "deletable_identity",
          "erasable": true,
          "commitment_method": "keel.salted_sha256_jcs.v1"
        },
        {
          "path": "/payment_rail",
          "value_type": "string",
          "required_for_authorization": true,
          "classification": "operational",
          "bulk_export_disclosure": "cleartext",
          "exact_pack_disclosure": "cleartext",
          "retention_class": "permit_evidence",
          "erasable": false,
          "commitment_method": "signed_cleartext"
        },
        {
          "path": "/request_digest",
          "value_type": "digest",
          "required_for_authorization": true,
          "classification": "operational",
          "bulk_export_disclosure": "omit",
          "exact_pack_disclosure": "cleartext",
          "retention_class": "permit_evidence",
          "erasable": false,
          "commitment_method": "signed_cleartext"
        }
      ],
      "release_state": "eligible"
    }
  ]
}
